,Search,Position,Company,Description
14,engineering,Engineering Co-Op,"Hottinger, Bruel & Kjaer","

This job will provide you with an opportunity to further your career alongside some of the best and most passionate technology experts from around the world in a leading company within the test, measurement and data analytics industry. You will be a strong contributor collaborating closely with colleagues from various business functions. 
At HBK, we live up to our three values: Be True, Own It and Aim High. We believe in absolute integrity – it’s how we win for stakeholders, the environment and each other. We believe in teamwork and keeping our promises – to ourselves and others. Finally, we believe in being bold and positive. This is how we perform at our best and achieve greater success. 
HBK Engineering Co-op Program 2022/2023 

Throughout the Co-op program, participants are exposed to many different core business units, while learning HBK’s processes and operating systems to achieve success. There are endless opportunities to build networks, develop strong relationships, and gain credible work experience. This program enables growth and development across the organization, with structured mentoring from senior engineers and business leaders. The unique design of the ERP focuses on career-driven individuals looking to maximize their learning, solve complex problems, and work for an industry leader in test and measurement. At the conclusion of the program, participants may have the opportunity to be placed in a dedicated role in our Americas team. 

Our Cooperative Education Program gives students the opportunity to supplement their education with valuable hands-on experience and training. Co-ops are paid and are typically work 4 to 5 months. Start date, January 2022 – December 2022 

Locations: Detroit, MI, Marlborough, MA , Tucson, AZ, Duluth, GA and or Remote 

Co-op opportunities depending on location 

Design Engineering/Sound and Vibration Engineering 
The student will become acclimated to the engineering workplace, design concepts, and improve skills in the daily utilization of engineering tools. 

Inside Sales 
Interact with sales team, product managers, and engineers to determine customer requirements and expectations to recommend specific products and solutions. In addition, students are expected to provide quotes and responses to RFPs. 

Applications Engineering 
Learn about the HBK suite of products with a focus in areas like data acquisition, sensors, and vibration test. Work in tandem with Application Engineers on customer projects and assist training activities. 

GCC & Calibration and Repairs 
Very important to our business to understand the workflow and support our customers. 
Working with equipment that students may be familiar with. Calibrations helps complete the picture of what we do. 

Technical Marketing & HR 
Create product technology collateral (presentations, white papers, etc.) to highlight HBK sounds and vibration applications and case studies. Assist in the creation of product videos for various HBK products. Assist with thought leadership on social media 

At the completion of the Co-op program students are expected to meet with their mentor to synthesize their observations and experiences in the various roles. The students are encouraged to discuss learned skills and accomplished goals with their mentor to maximize their experience at HBK. The Co-op student will also do a presentation of her/his project to an audience that could include peers, managers and leadership so that the Co-op student can showcase their learnings, contributions and network. 

What we want to see 


Candidate must be enrolled in an accredited a 4-year Accredited university/college in an Engineering discipline or Computer Science 
Minimum cumulative Grade Point Average of 2.7/4.0(no rounding) at current institution 
You must be enrolled in at least six units in an academic program related to the Co-Op project and must receive course credit for the co-op. 
Agree to work a minimum of two (2) co-op terms on an alternating term basis (more than two co-op terms is preferred) 
Candidates must be available to work full time for up to 6 consecutive months beginning January /August 2022 
Flexible with work assignment location/relocation 
Provide your own transportation to and from work location for each co-op assignment. 
Previous technical internship/co-op is a plus 
Candidate must be a Citizen or National of the United States, a lawful, permanent resident, or have authorization to work in the United States. Applicants must not now, or in the future, require sponsorship for an employment visa 


We offer 
The job will provide you with an opportunity to work on real projects and gain practical, hands-on experience alongside some of the best and most passionate technology experts from around the world in a leading company within the test and measurement industry. You will be a strong contributor who collaborates closely with colleagues from various business functions all over the world while enjoying a flexible work schedule. 

#LI-LM1

"
0,engineering,ENGINEERING DIRECTOR,Brigham & Women's Hospital(BWH),"


ENGINEERING DIRECTOR - (3194016)
  







General Summary/ Overview: Summarize the nature and level of work performed.





At Mass General Brigham, we care about our patients, employees and the communities that we serve. These important groups are at the center of all that we do.


We value Diversity and inclusion, interaction with Integrity & Respect, engage in Learning, embrace continuously Improvement & Personal Growth, believe in Teamwork and Collaborates.


The Director of Engineering represents the Hospital as the leader of the facilities and oversees all maintenance, operations, financial and regulatory activities of the Engineering Department. He/She will interact with leaders through the hospital both on and off-site.


They will represent the hospital within Brigham Health, MGB, LMA and Masco.






Principal Duties and Responsibilities: Indicate key areas of responsibility, primary job duties, special projects and key objectives for this position. These items should be evaluated throughout the year and included in the written annual evaluation.








Develops, secures approval of, implements and maintains policies and procedures for the Engineering Department.
Oversees the hiring, training, evaluation, and if necessary discharge of subordinate personnel.
Plan, develops, secures approval of and implements long range programs for the improvement and maintenance of the hospital facilities and maintains the Facility Condition Assessment.
Negotiates contracts with outside vendors for service and materials.
Provides professional and technical support for Engineering projects throughout the hospital incorporating redundancy and resiliency.
Ensures compliance with all appropriate codes and regulations. (i.e. Building Codes, Fire Codes, Federal and state agency Regulations, City Agencies, Insurance Requirements, etc.)
Writes and interprets complex specifications, and directs the development of and understandings of complex engineering drawings.
Oversees a 4 Mega Watt Cogeneration Plant is operating efficiently with Engie and Milton Cat running the day to day activities.
Justifies and maintains proper staffing of units of responsibility. Must maintain each shops efficiency during periods of change to the management team. Assesses Industry benchmark standards.
Responds to all emergency situations as appropriate and/or necessary.
Keeps management aware of the productivity and efficiency of units.
Develops, recommends and implements as required, new approaches, policies, and practices to effect continual improvement in the efficiency of the department and the services it provides. Keep abreast of developments in Plant Engineering.
Develops, processes for the safe and efficient coordination of utility shutdowns in support of enterprise capital construction projects in support of growth and expansion as defined.
Through subordinate supervisors assures the continuity and quality of all utilities (i.e. power, water, gases, air conditioning, etc.) for the hospital facilities. Directly responsible for the Co-Gen plant.
Participates on appropriate management committees as required. Represents depart,ent at Safety Huddle.
Must take responsibility as “Engineer-on-Call” during non-business hours overseeing the rotation of Assistant Director and Supervisors.
Performs other duties and responsibilities as may be assigned.








Supervisory Responsibilities: List the number of FTEs supervised.








The role oversees: (2) managers, (5) supervisors and (78)individual contributors in the engineering department.
As a people manager, we rely on you to embody our diversity and inclusion workplace policies by fostering an environment that understands the value of having a diverse organization and embrace it in action. Some of the ways that expect you to model that are:
Educate yourself on historical and contemporary publications.
Create a safe environment to talk about the topics proactively and openly.
Stay connected to your team, peers and others by asking for continuous feedback.
The role may indirectly provide leadership and guidance to less seasoned and new staff in other functional areas. 
Requires minimal direction from leadership and possesses the ability to learn quickly


 




Fiscal Responsibility: Indicate financial ""scope"" information, i.e.: size of budget, volume, revenue, etc.








Knowledgeable in the development of department financial data including but not limited to budget preparation and analysis, return on investment analysis, life cycle costing of engineering projects.
Works within the approved Deferred Capital Budget.
Demonstrates fiscal responsibility by effectively using Mass General Brigham resources


 




Working Conditions: Describe the conditions in which the work is performed.








Possible local travel to Mass General Brigham sites 
While performing the duties of this job, the employee is frequently required to sit; talk; or hear; use hands to finger; handle; or feel; reach with hands and arms. The employee is occasionally required to stand; walk; and stoop; kneel; or crouch. The employee must frequently lift and/or move up to 5 pounds and occasionally lift and/or move up to 20 pounds. Specific vision abilities required by this job include close vision, distance vision and depth perception. Climbs ladders, works within mechanical spaces that are warm, humid and loud.
The work environment characteristics described here are representative of those an employee encounters while performing the essential functions of this job. Normal office working conditions. The noise level in the work environment is quiet to moderate.











Qualifications: (Must be realistic, neither overstated nor understated, and related to the essential functions of the job.)








Bachelor of Science in Engineering and /or Business Administration.
Five years in responsible charge in Plant Engineering or Facilities Management/Operations.
Computer literate in business software necessary to perform the technical/management responsibilities of the position.
Industry Experience: Healthcare preferred or extensive experience working in a large, matrixed organization
Managerial Experience: Experience directing a large team and planning, managing and organizing resources within short/medium/long term timescales. (Over 8 years to 10 years)
Experience working with a union workforce.


 




Skills/Abilities: (Must be realistic, neither overstated nor understated, and related to the essential functions of the job.)








Possess strong interpersonal skills to effectively communicate with cross-functional teams, including staff at all levels of the organization
Ability to successfully negotiate and collaborate with others of different skill sets, backgrounds and levels within and external to the organization
Strong problem solving and negotiation skills
Uses expertise to act as an organizational authority on planning, organizing, prioritizing and overseeing activities to efficiently meet department needs.
Uses comprehensive knowledge and skills to independently work while providing team guidance and training to others on developing appropriate plans or analyzing data trends for use in reports to help guide decision making.
Acts on established expertise to analyze data trends for use in learning activities and reports to guide decision-making.
Applies comprehensive knowledge and skills to work independently while providing team guidance and training to others on reviewing and creating relevant, lucid and effective reports.
Uses comprehensive knowledge and skills to work independently while providing guidance and training to others on analyzing data from multiple sources to draw appropriate conclusions and make suitable recommendations.
Uses comprehensive knowledge and skills to communicate with other people independently while providing guidance and training to others on speaking in a clear, concise and compelling manner.


EEO Statement

 Brigham and Women’s Hospital is an Equal Opportunity Employer. All qualified applicants will receive consideration for employment without regard to race, color, religion, creed, sex, sexual orientation, gender identity, national origin, ancestry, age, veteran status, disability unrelated to job requirements, genetic information, military service, or other protected status. Brigham and Women’s Hospital is an Equal Opportunity Employer. 




Primary Location MA-Boston-BWH Boston Main Campus
  

 Work Locations BWH Boston Main Campus 75 Francis St Boston 02115
  

 Job Professional/Managerial
  

 Organization Brigham & Women's Hospital(BWH)
  

 Schedule Full-time
  

 Standard Hours 40
  

 Shift Day Job
  

 Employee Status Regular
  

 Recruiting Department Brigham & Women's Hospital
  

 Job Posting Apr 3, 2022
  


"
1,engineering,"Co-Op - Civil, Geotechnical, Environmental Engineering",Haley & Aldrich,"
Co-Op - Civil, Geotechnical, Environmental EngineeringAt Haley & Aldrich, our goal is to deliver exceptional service to our clients and our communities. And we know that to do so, we need diverse and unconventional thinkers. That’s why we foster a culture that provides collaboration, flexibility, and support – so our staff can bring their unique value to bear, and explore the areas they’re passionate about.Are you looking to work in an environment where you can be your authentic self and work on projects that are meaningful to you?We are looking to bring on a Co-Op to serve as a Civil/Environmental Engineering Technician assisting office engineers and project managers with day-to-day project tasks. This is a full-time role that will be at least 3 consecutive months. The anticipated start for this position is Spring/Summer 2022. This is a fantastic opportunity to get some hands-on, working field experience and be a valuable contributor to our project teams. This role will be based out of our Boston, MA office location.DUTIES/RESPONSIBILITIESThe successful candidate will: 

Serve in a field support role, working on some interesting and technically-challenging projects.
Assist engineers and Project Managers with the planning and execution of site characterization programs on various infrastructure and real estate development projects.
Assist with evaluation of subsurface geotechnical and environmental data.
Assist in performing geotechnical design/analysis and developing geotechnical recommendations.
Asist laboratory manager in running geotechnical testing on soil samples.
Express a willingness to visit construction sites to assist in the field with our construction monitoring service group.

SKILLS/EXPERIENCE

Candidate should be at least 2 years into their academic career
Candidate should be enrolled in a civil, geotechnical, or environmental engineering educational program (undergraduate or graduate)
GPA of 3.0 or better
Demonstrate initiative and a willingness to learn
Be a collaborative team player with excellent communication skills
Computer Skills – Strong computer literacy skills including proficiency in all MS Office software
40-hour OSHA trained and certified is preferred but not required
Driver’s license highly preferred
Ability to work for 3 or more consecutive months on a full-time basis

Job Type: Full-time
"
2,engineering,"Safety Support Engineer, Safety Engineering",Amazon.com Services LLC,"

Bachelor’s degree in Engineering a related science based field
 2+ years’ experience applying safety principles and addressing safety issues in a manufacturing, warehouse or other operations focused environment
 Knowledge and/or working experience with OSHA regulations, EU safety standards and standard industry safe work practices
 Ability to be on-call on a limited basis, including weekends and/or evenings



  Job summary
   Amazon Robotics designs, manufactures and implements cutting edge technologies within operations centers at the heart of Amazon’s core business. We are seeking exceptional and self-motivated individuals to support the Amazon Robotics system - ensuring optimal safety performance of critical global operations. 
  
 In this role, you will diagnose high-impact issues affecting the safety of Amazon’s operations and personnel, utilizing advanced trouble-shooting tools and procedures. Successful candidates will possess a blend of strong safety knowledge, trouble-shooting capabilities and customer-facing skills, along with a passion for cutting edge technology. 
  
 Location may be either Westborough, MA or North Reading, MA. 
  
 Job Responsibilities
  

 Leverage Support processes, systems and tools to resolve safety related technical problems
 Track issues through resolution phase, engaging technical subject matter experts and Safety Manager, as needed.
 Manage, prioritize, and respond to cases within defined SLA’s
 Provide technical guidance to Fulfillment Center (FC) Operations, Safety and Maintenance teams to troubleshoot operational challenges.
 Provide prompt, efficient, detailed, customer-oriented service to our internal Amazon Customer
 Create and maintain problem resolution procedures and identify need for new tools to support existing solutions
 Work with Engineering (SW/HW), Global Support (HSE/ARTS) and Amazon EHS teams to understand safety issues and solution options. Provide Safety Manager with the information required for decision-making.
 Compile data to facilitate analysis by the Safety team
 Attend internal AR meetings, including Design Reviews, Solutions layouts, and Risk Assessments, as required by Safety Manager.





Technical problem-solving and analytical skills
 Excellent written and oral communications skills with the ability to communicate effectively with both technical and non-technical stakeholders
 Experience working with escalations requiring rapid response
 Understanding of product safety concepts and techniques
 Proven ability to troubleshoot and identify the root cause of issues
 Proven ability to manage time allocated to specific tasks and escalations

 Amazon is committed to a diverse and inclusive workplace. Amazon is an equal opportunity employer and does not discriminate on the basis of race, national origin, gender, gender identity, sexual orientation, protected veteran status, disability, age, or other legally protected status. For individuals with disabilities who would like to request an accommodation, please visit https://www.amazon.jobs/en/disability/us.
 
"
3,engineering,Engineering Technician,Federal Aviation Administration,"
Serves as an entry level Field Maintenance Program Engineering Technician assigned to facility improvement projects throughout the Eastern Area. Performs basic, progressively more difficult assignments. Receives academic and on-the-job instruction.
Work is completed using various general and specialized trade skills, including but not limited to: electrical, carpentry, metal and composite roofing, concrete, plumbing, welding, dry wall, chain-link and iron fencing, painting, masonry, Gasoline & Diesel mechanic, HVAC, heavy equipment maintenance, operations of heavy machinery and commercial vehicles.
The incumbent is expected to help senior technicians, develop cost estimates for various projects, gather technical data, evaluate/formulate safety procedures and determine manpower requirements for assigned projects.
Job Type: Full-time
Pay: $53,643.00 - $80,467.00 per year
Benefits:

401(k)
Dental insurance
Employee assistance program
Flexible schedule
Flexible spending account
Health insurance
Health savings account
Life insurance
Paid time off
Retirement plan
Vision insurance

Schedule:

10 hour shift
8 hour shift
Monday to Friday

Application Question(s):

Must be a US Citizen

Education:

High school or equivalent (Preferred)

License/Certification:

Driver's License (Preferred)

Willingness to travel:

100% (Preferred)

Work Location: One location
"
4,engineering,Drafter - R&D,CorTech,"

  Position Title: Mechanical CAD Designer
  
 Position Summary:
   The Mechanical CAD Designer will contribute to product development by designing mechanisms and complex assemblies in collaboration with R&D engineers using latest toolsets and industry leading best practices. You will contribute to realizing the next generation of interventional robotic platform. This position will work with new and existing medical device products, generating CAD models, detail designs (in SolidWorks), creating parts drawings, assembly drawings and instructions, and BOMs under the engineering change control (ECO). This is a collaborative opportunity where you will work cross-functionally with Quality Assurance, Quality Control, Manufacturing, and external vendors.
  
 Primary Responsibilities:
  

Contributes to mechanical and electromechanical CAD design of the new and existing products
Support R&D engineering needs, design updates, and refinement
Construct DMR/BOMs, prepare ECO’s and work with Document Control to implement
Provide detailed design drawings and annotated MBD models per prototype and production level engineering requirements.

 Qualifications:
  

8+ years experience in a CAD design and drafting position required; at least 5 years in the Medical Device industry (or other regulated industry)
BSc in Mechanical Engineering. Associate’s degree in Mechanical Design, or equivalent, will be considered.
Advanced SolidWorks proficiency with demonstrated capability to produce complex parts and assemblies required
SolidWorks PDM experience required
Experience with the creating and publishing MBD (Model-Based Design) models required
Experience with metal fabrication processes such as milling and turning, etc. required
Experience designing and dimensioning using the metric system and GD&T required
Document Control experience required
Electromechanical design experience working with SolidWorks Electrical 2D and 3D highly desired


"
