,Search,Position,Company,Description
8,engineering,Environmental Scientist/Analyst,Greenman-Pedersen Inc.,"Do you have a strong interest in improving the quality of life for people? Are you looking to advance your career by joining a team that strives to provide communities with sustainable solutions for transportation? Do you value a company that puts employee satisfaction and diversity at the forefront of who they are? If so, GPI wants you!

GPI is seeking an environmental scientist/analyst with 0 to 5 years experience for our growing transportation group in our Boston, MA or Wilmington, MA office. The qualified candidate will assist with the environmental review and permitting process for various transportation improvement projects in New England. We are looking for individuals that are ready to work collectively with a multi-discipline team of engineers in a dynamic office environment on interesting and challenging projects. Projects in our Boston/Wilmington offices involve varying types of roadway, bridge, intersection, and trail designs with a focus on ‘complete streets’ style projects for State and Municipal clients. GPI understands the significant responsibility we have to provide safe, unique, and context-sensitive transportation solutions to the many communities and clients we serve. GPI offers flexible work schedules with the ability to split time between working in the office and from home. This position provides an exceptional opportunity for career growth as the selected candidate will be exposed to a wide range of projects. Compensation is commensurate with skills and experience.

GPI is a multi-discipline engineering firm that has been providing planning, design, and construction services for transportation infrastructure and building system projects throughout the United States for over 55 years. Ranked in the Top 100 Firms by Engineering News Record, GPI is a forward-thinking, innovative firm with a culture that is committed to excellence and fosters staff empowerment. For more information visit: www.gpinet.com

GPI’s success is built around its seven strategic objectives which starts with employee satisfaction. This is evident by the longevity of our employee retention and the family culture which is felt within our organization. As an employee-owned company, we work together as a team with a common goal to succeed.

Responsibilities will include:
Support the design team by identifying potential environmental impacts and required permits
Perform site visits to assess and document existing conditions
Review historic and cultural resources within or adjacent to proposed projects
Prepare permit documents to be filed under various local, state, and federal regulations
Create environmental plans to accompany permitting documents
Quantify impacts to wetlands and other environmentally sensitive areas
Identify appropriate locations and methods for stormwater management and impact mitigation
Coordinate project reviews with various clients and local, state, and federal agencies
Attend hearings and present the project and its proposed impacts to local Conservation Commissions
Respond to comments generated during the local, state, and federal review processes
Coordinate with project abutters and concerned citizens
Record all project certifications with the appropriate state and local agencies

Qualifications:

BA / BS in Environmental Science, Ecology, Biology, Environmental Engineering or other related fields
Interest in the Transportation Engineering field
Interest in environmental legislation and the review/permitting process
AutoCAD experience a plus
MINIMUM REQUIREMENTS:

Maintain a valid driver's license with a clean motor vehicle report (MVR) for final consideration
Read, write, and understand plans and directions given in the English language
Basic computer skills with the ability to create and edit Microsoft Word and Excel documents, create Outlook emails, and utilize SharePoint and Microsoft Teams to communicate with other team members
Able to stand for approximately 3 hours minimum a day up to 8 hours
Able to wear GPI required PPE, i.e., hard hats, safety vest, work boots, and/or safety glasses/goggles while working
GPI offers excellent benefits, including a 401(k) plan, ESOP, medical/dental/vision plans, and vacation/sick/personal time, and more. GPI is an equal opportunity employer. All qualified applicants will receive consideration for employment without regard to race, color, religion, sex, sexual orientation, national origin, disability, or protected veteran status."
9,engineering,"Scientist, Strain Engineering",Greenlight Biosciences,"


ABOUT GREENLIGHT
 At GreenLight we are working to solve two of the world's greatest problems: global food insecurity and equal access to vaccines and the associated health benefits. Unlike most corporations who can be required to put profits ahead of other principles, GreenLight is one of the first Public Benefit Corporations to be publicly traded and have a charter that requires a focus on how it benefits its employees, community and society and has a broad portfolio addressing key issues in plant health and human health (Nasdaq: GRNA) by leveraging the full potential of dsRNA and mRNA. The GreenLight team is over 300 people across our headquarters in Medford, MA, an R&D facility in Woburn, MA and an R&D facility in Research Triangle Park, NC. GreenLight also has a biomanufacturing plant in Rochester, NY. Initiatives include finding ways to support biodiversity, protect bees and other pollinators, treat rare diseases as well as develop vaccines.
 At GreenLight, we believe inclusion is the way forward. We celebrate the power of working together to address humanity's challenges, meet the needs of underserved populations, and push the boundaries of scientific discovery. Fueled by our aspiration for a true sense of belonging, our talented teams embody the principles of diversity and equality as we strive to bring food security, medicine, and healthcare to everyone—paving the way for a sustainable future. For more information, visit www.greenlightbio.com.

 POSITION SUMMARY
 Our team is seeking an exceptional and highly motivated microbial strain engineer to help advance the company's RNA platform technology. This position will report to the Head of Strain Engineering. Ideal candidates will leverage their prior experience with high-throughput workflows to implement an automated synthetic biology pipeline to build and screen plasmid constructs and production strains for use in the company's proprietary bioproduction platform. A strong technical background and proficiency in routine molecular biology workflows and wet lab techniques (including microbial culturing, cloning and strain construction) is absolutely required to translate these routine workflows onto a high-throughput basis. Strong technical, organizational, and communication skills, as well as the ability to work well in a team setting, are essential. This is a full-time position.
 MAJOR RESPONSIBILITIES

Design, build and test proof-of-concept plasmid and strain constructs using modular DNA parts assembly and chromosomal editing to build rational libraries
Collaborate with colleagues in other teams at GreenLight to implement analytical workflows for screening libraries of plasmid and strain constructs for desired traits
Design and implement a high-throughput process for plasmid and strain construction by recommending equipment purchases and best practices for successful operation
Carry out small-volume bioreactor experiments to test engineered strains prior to bench-scale fermentor trials
Design and implement a high-throughput process for testing engineered strains in small-volume reactors prior to bench-scale fermentor trials
Work with strain engineers and automation scientists to implement and continually improve these high-throughput processes
Train and collaborate with other GreenLight team members to be able to successful leverage these processes for different projects to facilitate the successful achievement of project goals and milestones in a timely manner
Work independently and as part of a team on multidisciplinary projects
Maintain diligent and organized records about experimental protocols, procedures, and results
Participate in general laboratory activities, such as inventory, equipment maintenance, and laboratory clean-up
Clearly communicate results and recommendations to colleagues, managers, and senior management, to assist in project decision-making

PROFESSIONAL EXPERIENCE / QUALIFICATIONS

Absolute requirement of at least 1-3 years of experience working with high-throughput processes specifically to build plasmids and strains in the biotechnology or biopharmaceutical industries
Experience in working with Escherichia coli (culturing, aseptic technique, transforming, making chromosomal modifications etc.) is required. Familiarity with other microorganisms would be a plus
Deep experience with building DNA plasmids employing standard molecular biology techniques such as PCR, isothermal assembly, Golden Gate assembly, agarose gel electrophoresis, DNA sequencing analysis, cell transformation and cell culture
Strong proficiency in routine molecular biology techniques (e.g., PCR, cloning, restriction digests, microbial transformations, agarose & SDS PAGE gel electrophoresis, plasmid minipreps, using plate readers etc.) is an absolute must
Proficiency in using Excel, PowerPoint and one or more sequence analysis & design software packages (e.g. Vector NTI, Geneious, SnapGene etc.) is required. Experience working with electronic lab notebooks is preferred
The successful candidate must be highly motivated and have exceptional written and oral communication, leadership, and teamwork skills and must have high standards for one's own work. Ability to multitask is essential in this fast-paced environment
Flexibility to work in shifts / over weekends to meet current social distancing norms in the workspace may be required

EDUCATION

Ph.D. in chemical engineering, bioengineering, molecular biology, biochemistry, or related field


 Greenlight Biosciences Inc. provides equal employment opportunities to all employees and applicants for employment and prohibits discrimination and harassment of any type without regard to race, color, religion, age, sex, national origin, disability status, genetics, protected veteran status, sexual orientation, gender identity or expression, or any other characteristic protected by federal, state or local laws.
 This policy applies to all terms and conditions of employment, including recruiting, hiring, placement, promotion, termination, layoff, recall, transfer, leaves of absence, compensation, and training.
 GreenLight requires proof of COVID-19 vaccination for its employees consistent with OSHA guidelines.



"
10,engineering,Display Mechanical Engineer,Amazon.com Services LLC,"

Bachelors in display engineering, mechanical engineering, physics, materials science, optics.
2+ years of experience in the display industry.
Opto-mechanical testing experience.
Experience managing assemblies and creating detailed documentation
3+ years of 3D CAD experience with proficiency in Pro-E, Creo, Autocad
1+ years of experience with Product Lifecycle Management (PLM) software and BOM (Bill of Materials).
1+ years of experience in working with international, cross-functional teams, including 3rd party manufacturing teams and contract manufacturers
 Job summary 
 
 Amazon Lab126 is an inventive research and development company that designs and engineers high-profile consumer electronics. Lab126 began in 2004 as a subsidiary of Amazon.com, Inc., originally creating the best-selling Kindle family of products. Since then, we have produced groundbreaking devices like Fire tablets, Fire TV and Amazon Echo. What will you help us create? 
 

The Role:
 As a Display Mechanical Engineer, you will engage with an experienced cross-disciplinary staff to conceive and design innovative consumer products. You will work closely with an internal inter-disciplinary team, and outside partners to drive key aspects of product definition, execution and test. You must be responsive, flexible and able to succeed within an open collaborative peer environment. In this role, you will: 
 

Serve as the technical lead for display/optics components through the entire product life cycle, from road mapping through design in to mass-production support
Manage the technical relationship with vendors to deliver display components to the required specification and schedule
Perform hands-on bring-up, testing and troubleshooting of touch subsystems and display assemblies and associated control electronics
Function as a subject matter expert on display technology by providing up-to-date, accurate information to colleagues and management
Travel to supplier and contract manufacturer sites world-wide to support product development activities (10% - 20% travel)
 About the team 
 The display team’s primary goal is to design & integrate display modules for Fire Tablets, Kindle, FireTV, Echo & Halo devices org. Our team scope & conceives display modules to meet end product and internal customer requirements. This team collaborates with other Amazon teams on new technologies looking for new innovative ways that can improve our products. We build working demo and architecture documents for new technology Proof-Of-Concept evaluations with a startup mentality to fail fast. The team is focused on HW product development (NPI), New Technology Investigation (NTI) and support issues in sustaining shipping devices from the field. 
 


Experience in working with international, cross-functional teams
Hands-on experience with mobile device or display development, testing and product integration
Experience with DFMA software is a plus
Experience with thermal analysis and material is a plus
Experience with tolerance analysis
Strong hands on experience with the ability to craft simple proof-of-concept models in-house
Thorough understanding and use of principals, theories and concepts in mechanical engineering
Excellent verbal and written communication skills
 Amazon is committed to a diverse and inclusive workplace. Amazon is an equal opportunity employer and does not discriminate on the basis of race, national origin, gender, gender identity, sexual orientation, protected veteran status, disability, age, or other legally protected status. For individuals with disabilities who would like to request an accommodation, please visit https://www.amazon.jobs/en/disability/us.
"
11,engineering,Engineering Co-Op,Motion Industries,"

Engineering Co-Op This is located in Danvers, MA.
 Leading New England Automation company seeking an Engineering Co-Op. Exciting opportunity for an ambitious Engineering student to learn and develop skills required in today’s competitive job market. We are seeking an Engineering student (Mechanical, Electrical, or Manufacturing) to assist our production team. The ideal student should have some technical writing experience, mechanical aptitude and great attention to detail.
 During the COOP the student will learn about:

 Manufacturing procedures are written and documented
 New Product Introduction (NPI) Process
 Understand cycle time and conducting time studies
 Develop jigs and fixtures to increase efficiency of manufacturing processes
 Engineering Change Orders (ECOs) - How they are generated and processed.
 Servo and Stepper motors function
 Optical Encoders
 Motor amplifiers

 The student will be working side by side with the Manufacturing Engineer to learn the above skills. Above all we seek a student willing to learn that possesses a great work ethic. We look forward to discussing this opportunity with any interested candidates.

"
12,engineering,Simulation Development Engineer I,Boston Children's Hospital,"




     61565BR
    



     Anesthesia
    


Job Posting Description

The Simulation Development Engineer performs a variety of engineering activities in the design and fabrication of novel mechanical and digital assets as an integral part of the services provided by the SIMPeds Engineering Team to collaborators within the Boston Children’s Hospital community. Additional information regarding the Simulator Program can be found on www.simpeds.org  This Simulation Development Engineer I will be responsible for:  + Contributing to concept development and product design development team projects and may lead small-scale projects.  + Designing and fabricating devices for clinical and research applications, and anatomic training models for healthcare simulation as per specifications or conceptual ideas with the aid of drawings, sketches and verbal descriptions.  + Using CAD (SolidWorks preferred) and digital sculpting tools (Zbrush, Mudbox, or Blender) to develop prototype designs and tooling.  + Applying knowledge of anatomy towards the development of custom neonatal or pediatric surgical treatment and training devices, and digital media.  + Incorporating and continually improving technical expertise, understanding of mechanisms, and prototype fabrication techniques including RTV silicone molding, 3D printing, and workshop hand & power tool use.  To qualify, you must have:  + Bachelor of Science in Engineering, Biomedical Art & Visualization, Industrial Design or similar field. Master's Degree preferred.  + 1 years minimum of related experience in one or more of the following: 3D Printing, Computer Aided Design, Organic Modeling, Device Development, Immersive Technologies, Manufacturing, Materials. Advanced degree may substitute for experience.  + Ability to follow established best work practices.  + Ability to effectively work in a team, and to think critically, analyze options and to create great solutions to problems not previously encountered.  + Ability to approach the role with curiosity and persistent desire for continuous learning to maintain technical competence.
 This position is eligible for an Employee Referral Bonus.  Boston Children’s Hospital offers competitive compensation and unmatched benefits, including affordable health, vision and dental insurance, generous levels of time off, 403(b) Retirement Savings plan, Pension, Tuition Reimbursement, and discounted rates on T-passes (50% off). Discover your best.




Status

     Full-Time
    


Regular, Temporary, Per Diem

     Regular 
    


Standard Hours per Week

     40 
    


Office/Site Location

     Boston
    


Job Category

     Administration
    




"
13,engineering,Environmental Compliance Specialist - Work From Home,FedEx Ground,"
This position is a work from home role. Preference is for this position to be domiciled in the North East as overnight travel is required within this geographical area.
Hiring for multiple position levels:  Environmental Compliance Specialist I, II, Sr.
Job Summary 
Oversees and supports legal and regulatory environmental compliance by administering related programs, projects and functions, as well as by providing technical and training support to field operations. Serves as a knowledge resource to other environmental compliance specialists and field operations personnel. Coordinates and provides oversight to contracted environmental consultants and vendors.
Essential Functions

Implements and monitors environmental compliance programs for an established territory working closely with other compliance specialists to support regional compliance programs. Programs may include, but are not limited to, stormwater, wastewater, hazardous materials, hazardous waste, air quality, above and/or below ground storage tanks, environmental due diligence, and other associated programs. Travels routinely to conduct station audits within an established territory and works with station management to create action plans to resolve identified issues. Travels routinely, and sometimes on short notice, to assist station management including, but not limited to, preparation for regulatory audits and inspections, regulatory violation response, spill response, training, community complaints, general compliance support, etc. Coordinates and communicates with internal and external customers, vendors, and local, state, and federal agencies. Oversees the process of preparing and submitting environmental permit applications to state, local, or federal agencies. Works with vendors and consultants as needed for compliance needs. Tasks include establishing scope of work, preparing project specifications, obtaining bids, submitting for budget approvals, reviewing, awarding, administering contracts, and monitoring contract spend. Provides guidance and direction to station management with the operation and maintenance of environmental related equipment, systems and controls. Serves as a hazardous materials resource to station operations implementing internal policies and procedures. Evaluates environmental assessments of property acquisitions; reports observations, conclusions, and recommendations to all levels of company management as needed. Support station management on tasks associated with the corporate internal auditing process.

Minimum Education

Bachelor’s degree in an environmental science, policy, compliance, or related field required.

Minimum Experience
Three (3) years’ experience required in environmental compliance including direct experience with at least one of the following regulatory programs: stormwater, wastewater, hazardous materials, hazardous waste, air quality, aboveground and below ground storage tanks, environmental due diligence and/or other associated programs (e.g. RCRA, CERCLA, DOT, etc.)
Required Skills, Abilities and / or Licensure

Familiarity with Federal and State environmental regulations related to stormwater, wastewater, hazardous materials, hazardous waste, air quality, aboveground and below ground storage tanks, environmental due diligence and/or other associated programs (e.g. RCRA, CERCLA, DOT, etc.) Software skills, including use of Microsoft Office software and web-based applications. Verbal and written communication skills necessary to explain complex and/or confidential information. Presentation skills necessary to facilitate training and/or deliver informational sessions to groups and/or individuals. Time management and organizational skills necessary to manage multiple projects, appropriately prioritize workload, plan for resources to meet deadlines and goals, and respond to day-to-day functional needs. Ability to anticipate and identify problems and use sound judgment and fact-based analysis to develop effective and efficient solutions. Ability to troubleshoot issues, manage resources, and develop solutions. Ability to mentor, coach and act as a knowledge resource to other employees. Knowledge of concepts, practices, policies and procedures used in field operations Knowledge of concepts, practices, policies, and procedures related to environmental compliance laws and regulations preferred.

% of Travel for the Position: 25-50%
EEO Statement
FedEx Ground is an equal opportunity / affirmative action employer (Minorities/Females/Disability/Veterans) committed to a diverse workforce
Job Type: Full-time
Benefits:

401(k)
Dental insurance
Employee assistance program
Employee discount
Health insurance
Paid time off
Parental leave
Retirement plan
Tuition reimbursement
Vision insurance

Work Location: Multiple Locations
"
